0,1,2
ANNUAL REPORT 2023,Regulatory evolution,
,Three delegated acts have been published supplementing Regulation (EU) 2020/852:,"According to article 8 of the Regulation, in 2023 companies must report:"
INDEX,"· On June 4th, 2021, the Climate Change Mitigation and Adaptation objectives were published in Delegated Regulation 2021/2139. This delegated act on climate taxonomy establishes the",· Eligibility and alignment in accordance with Delegated Regulation 2021/2139 the objectives of Mitigation and Adaptation of Climate Change.
,technical screening criteria for determining whether an economic activity qualifies as contributing substantially to climate change mitigation or adaptation and for determining whether this causes no significant harm to any of the other environmental objectives.,· Eligibility of new activities included in the Environmental Delegated Regulation and the amendment to the Climate Delegated Regulation.
1. Letter from the Chairman 2. Gestamp Group,"· On July 6th, 2021, Delegated Regulation 2021/2178 was published, which in article 8 in particular specifies the content and presentation of information to be disclosed by companies subject to the NFRD (Non-Financial Reporting Directive).","The regulations establish a series of economic activities (eligible activities). For an activity to be considered aligned, it must contribute substantially to one of the environmental objectives (mitigation or adaptation to climate change), not cause significant harm to any of the remaining environmental objectives and comply with minimum social safeguards."
3. ESG Perspective,"· Lastly, on March 9th, 2022, Delegated Regulation (EU) 2022/1214 was published which amends the previous Delegated Regulations and includes, subject to strict conditions, relevant nuclear and gas related activities in the list of economic activities covered by EU taxonomy8.","Likewise, the most relevant information must be included in relation to compliance with the regulations, the accounting policy and qualitative information that allows contextualizing the results obtained and facilitating the understanding of the KPIs."
4. Environmental Dimension,"· On June 27th, 2023, it was published:",In 2023 it has not been identified activities associated with other objectives beyond Climate Change
5. Social Dimension 6. Governance,"- Delegated Regulation (EU) 2023/2486, which supplements Regulation (EU) 2020/852 of the European Parliament and of the Council by establishing the technical selection criteria to determine under what conditions an economic activity will be considered contributes substantially to the rest of the objectives of the taxonomy and to determine whether said economic activity does not cause significant harm to any of the other environmental objectives, and which modifies Delegated Regulation (EU) 2021/2178.","Mitigation. However, in 2024 a review of the activities will be carried out as a result of the integration of Gescrap in the development of Non-Financial Information. SCOPE OF THE REPORT"
7. Annexes,"- Delegated Regulation (EU) 2023/2485, which modifies Delegated Regulation (EU) 2021/2139 establishing additional technical selection criteria to determine the conditions under which an economic activity is considered to contribute substantially to mitigation or adaptation to climate change, and to determine whether that economic activity does not cause significant harm to any of the other environmental objectives.",The scope of the analysis has included all the Gestamp Group's operating plants included in the scope of this non-financial information report (see chapter About this Report).
