0,1,2,3,4
Standard,Disclosure,Reference,Additional information and reasons,External audit*
3-3,Management of material topics,"71 SR . Resource conservation . Materiality and goals 7 SR . Resource conservation . Group-wide resource management
:selected: :selected:",,no
306-1,Waste generation and significant waster- elated impacts,"7] SR . Resource conservation . Less waste
:selected:",,no
306-2,Management of significant wasterelated impacts,"7] SR > Resource conservation . Less waste
:selected:",,no
306-3,Waste generated,"7 SR . Resource conservation . Key figures Waste by waste type (in 1,000 t) 71 SR . Resource conservation . Key figures Specific waste in production (in kg/vehicle)
:selected: :selected:",,no
306-4,Waste diverted from disposal,"7SR . Resource conservation . Recycling - keeping the end in mind from the start 71 SR . Resource conservation . Key figures Waste by waste type (in 1,000 t)
:selected: :selected:","306-4 b+c+d) As there were no hazardous or non-hazardous waste streams diverted from disposal within the Mercedes-Benz Group in the reporting year, there are also no data available on the various recovery processes or on whether the waste is further processed for recycling on site/not on site.","partially, key figures"
306-5,Waste directed to disposal,"71 SR > Resource conservation . Removal of workshop waste with MeRSy 7 SR . Resource conservation . Less waste 7SR . Resource conservation . Key figures Waste by waste type (in 1,000 t)
:selected: :selected: :selected:","In general, the waste is collected by a waste disposal company and an approved waste processor then processes the waste at a different location. In addition, there are no data on the various disposal methods of the disposal company.","partially, key figures"
