0,1
Cross-reference tables,454
Cross-reference table for the Universal Registration Document,454
Cross-reference table for the Annual,458
Financial Report,
Cross-reference table for the Management Report as provided for by Articles L. 225-100 et seq. and L. 22-10-35 et seq. of the French Commercial Code,459
Cross-reference table for the Corporate Governance Report as provided for by Articles L. 225-37 et seq. of the French Commercial Code,461
Cross-reference table for the non-financial information statement,462
Safe harbor statement,463
