0,1,2,3,4,5,6,7,8,9
COMPANY PENSION FOR THE EXECUTIVE BOARD 2022/2023,,,,,,,,,
,,Miguel Ángel López Borrego,,Oliver Burkhard,,Dr. Klaus Keysberg1),,Martina Merz,
,,"Chairman of the Executive Board since June 1, 2023",,"Ordinary member of the Executive Board since February 1, 2013",,"Ordinary member of the Executive Board since October 1, 2019",,"Chairwoman of the Executive Board October 1, 2019 - May 31, 2023",
€000s,,2021/2022,2022/2023,2021/2022,2022/2023,2021/2022,2022/2023,2021/2022,2022/2023
Figures in accordance with IFRS,Service costs,—,—,6,3,155,559,—,—
,Present value of the obligation,—,—,"5,646","5,244",375,874,—,—
Figures in accordance with the German Commercial Code (HGB),Service costs,—,—,5,5,123,598,—,—
,Present value of the obligation,—,,,"9,098",,,,—
,,,—,"9,060",,"3,679","4,501",—,
